results.csv

time,package_url,import_name,task,accuracy,train_minutes,seed
2026-10-06 16:16,git+https://github.com/JesseTNRoberts/AI4200-imagenet32x32-baseline-model.git,residual_mlp_baseline,mnist,0.9506,0.6,0
2026-10-06 16:17,git+https://github.com/JesseTNRoberts/AI4200-imagenet32x32-baseline-model.git,residual_mlp_baseline,cifar10,0.4861,1.3,0
2026-10-06 16:30,git+https://github.com/JesseTNRoberts/AI4200-imagenet32x32-baseline-model.git,residual_mlp_baseline,imagenet32,0.0677,12.4,0
2026-10-07 19:22,git+https://github.com/cchamb-gh/AI4200-imagenet32x32-baseline-model.git,residual_mlp_baseline,mnist,0.9506,0.6,0
2026-10-07 20:01,git+https://github.com/cchamb-gh/AI4200-imagenet32x32-baseline-model.git,residual_mlp_baseline,mnist,0.9506,0.7,0
2026-10-08 13:50,git+https://github.com/cchamb-gh/AI4200-imagenet32x32-baseline-model.git,residual_mlp_baseline,mnist,0.9723,1.1,0
2026-10-15 12:39,git+https://github.com/cchamb-gh/AI4200-imagenet32x32-baseline-model.git,residual_mlp_baseline,mnist,0.9811,1.1,0
2026-10-15 12:45,git+https://github.com/cchamb-gh/AI4200-imagenet32x32-baseline-model.git,residual_mlp_baseline,mnist,0.9811,1.1,0
2026-10-15 13:32,git+https://github.com/cchamb-gh/AI4200-imagenet32x32-baseline-model.git,residual_mlp_baseline,mnist,0.9811,1.1,0
2026-10-15 13:34,git+https://github.com/cchamb-gh/AI4200-imagenet32x32-baseline-model.git,residual_mlp_baseline,cifar10,0.4951,1.5,0
2026-10-15 13:48,git+https://github.com/cchamb-gh/AI4200-imagenet32x32-baseline-model.git,residual_mlp_baseline,imagenet32,0.0772,13.7,0
2026-10-16 22:28,git+https://github.com/cchamb-gh/AI4200-imagenet32x32-baseline-model.git,residual_mlp_baseline,mnist,0.9784,0.5,0
2026-10-19 15:20,git+https://github.com/cchamb-gh/AI4200-imagenet32x32-baseline-model.git,residual_mlp_baseline,mnist,0.9704,0.3,0
2026-10-19 16:05,git+https://github.com/cchamb-gh/AI4200-imagenet32x32-baseline-model.git,residual_mlp_baseline,mnist,0.9705,0.3,0
2026-10-19 16:06,git+https://github.com/cchamb-gh/AI4200-imagenet32x32-baseline-model.git,residual_mlp_baseline,cifar10,0.5426,1.4,0
2026-10-19 16:19,git+https://github.com/cchamb-gh/AI4200-imagenet32x32-baseline-model.git,residual_mlp_baseline,imagenet32,0.0889,12.5,0
2026-10-19 16:56,git+https://github.com/cchamb-gh/AI4200-imagenet32x32-baseline-model.git,residual_mlp_baseline,mnist,0.8629,0.6,0
2026-10-19 17:00,git+https://github.com/cchamb-gh/AI4200-imagenet32x32-baseline-model.git,residual_mlp_baseline,cifar10,0.5574,4.8,0
2026-10-19 17:43,git+https://github.com/cchamb-gh/AI4200-imagenet32x32-baseline-model.git,residual_mlp_baseline,imagenet32,0.0924,42.5,0
2026-10-26 13:40,git+https://github.com/cchamb-gh/AI4200-imagenet32x32-baseline-model.git,residual_mlp_baseline,mnist,0.1135,0.6,0
2026-10-26 14:36,git+https://github.com/cchamb-gh/AI4200-imagenet32x32-baseline-model.git,residual_mlp_baseline,mnist,0.9775,0.7,0
2026-10-26 14:37,git+https://github.com/cchamb-gh/AI4200-imagenet32x32-baseline-model.git,residual_mlp_baseline,cifar10,0.5129,1.6,0
2026-10-26 14:52,git+https://github.com/cchamb-gh/AI4200-imagenet32x32-baseline-model.git,residual_mlp_baseline,imagenet32,0.0586,14.8,0
2026-10-26 16:38,git+https://github.com/cchamb-gh/AI4200-imagenet32x32-baseline-model.git,residual_mlp_baseline,mnist,0.9728,0.7,0
2026-10-26 16:40,git+https://github.com/cchamb-gh/AI4200-imagenet32x32-baseline-model.git,residual_mlp_baseline,cifar10,0.4473,1.8,0
2026-10-26 16:57,git+https://github.com/cchamb-gh/AI4200-imagenet32x32-baseline-model.git,residual_mlp_baseline,imagenet32,0.0483,16.5,0
2026-10-26 17:09,git+https://github.com/cchamb-gh/AI4200-imagenet32x32-baseline-model.git,residual_mlp_baseline,mnist,0.9752,0.7,0
2026-10-26 17:10,git+https://github.com/cchamb-gh/AI4200-imagenet32x32-baseline-model.git,residual_mlp_baseline,cifar10,0.4505,1.7,0
2026-10-26 17:19,git+https://github.com/cchamb-gh/AI4200-imagenet32x32-baseline-model.git,residual_mlp_baseline,mnist,0.9752,0.7,0
2026-10-26 17:21,git+https://github.com/cchamb-gh/AI4200-imagenet32x32-baseline-model.git,residual_mlp_baseline,cifar10,0.4505,1.7,0
2026-10-26 23:42,git+https://github.com/cchamb-gh/AI4200-imagenet32x32-baseline-model.git,residual_mlp_baseline,mnist,0.9732,0.7,0
2026-10-26 23:44,git+https://github.com/cchamb-gh/AI4200-imagenet32x32-baseline-model.git,residual_mlp_baseline,cifar10,0.4713,1.9,0
2026-10-27 00:00,git+https://github.com/cchamb-gh/AI4200-imagenet32x32-baseline-model.git,residual_mlp_baseline,imagenet32,0.0744,16.5,0
2026-10-27 18:34,git+https://github.com/cchamb-gh/AI4200-imagenet32x32-baseline-model.git,residual_mlp_baseline,mnist,0.9781,0.7,0
2026-10-27 18:36,git+https://github.com/cchamb-gh/AI4200-imagenet32x32-baseline-model.git,residual_mlp_baseline,cifar10,0.5327,1.8,0
2026-10-27 22:26,git+https://github.com/cchamb-gh/AI4200-imagenet32x32-baseline-model.git,residual_mlp_baseline,mnist,0.9729,0.8,0
2026-10-27 22:28,git+https://github.com/cchamb-gh/AI4200-imagenet32x32-baseline-model.git,residual_mlp_baseline,cifar10,0.4248,1.9,0
2026-10-27 22:45,git+https://github.com/cchamb-gh/AI4200-imagenet32x32-baseline-model.git,residual_mlp_baseline,imagenet32,0.0440,16.4,0
2026-10-29 12:03,git+https://github.com/cchamb-gh/AI4200-imagenet32x32-baseline-model.git,residual_mlp_baseline,mnist,0.9732,0.4,0
2026-10-29 12:06,git+https://github.com/cchamb-gh/AI4200-imagenet32x32-baseline-model.git,residual_mlp_baseline,cifar10,0.5513,2.5,0
2026-10-29 12:26,git+https://github.com/cchamb-gh/AI4200-imagenet32x32-baseline-model.git,residual_mlp_baseline,imagenet32,0.0813,20.3,0
2026-10-29 13:03,git+https://github.com/cchamb-gh/AI4200-imagenet32x32-baseline-model.git,residual_mlp_baseline,mnist,0.9730,0.4,0
2026-10-29 13:05,git+https://github.com/cchamb-gh/AI4200-imagenet32x32-baseline-model.git,residual_mlp_baseline,cifar10,0.5490,2.0,0
2026-10-29 13:22,git+https://github.com/cchamb-gh/AI4200-imagenet32x32-baseline-model.git,residual_mlp_baseline,imagenet32,0.0839,16.5,0
2026-10-29 13:47,git+https://github.com/cchamb-gh/AI4200-imagenet32x32-baseline-model.git,residual_mlp_baseline,mnist,0.9767,0.4,0
2026-10-29 13:49,git+https://github.com/cchamb-gh/AI4200-imagenet32x32-baseline-model.git,residual_mlp_baseline,cifar10,0.5717,2.1,0
2026-10-29 14:07,git+https://github.com/cchamb-gh/AI4200-imagenet32x32-baseline-model.git,residual_mlp_baseline,imagenet32,0.0852,17.2,0
2026-10-29 19:18,git+https://github.com/cchamb-gh/AI4200-imagenet32x32-baseline-model.git,residual_mlp_baseline,mnist,0.9894,1.1,0
2026-10-29 19:20,git+https://github.com/cchamb-gh/AI4200-imagenet32x32-baseline-model.git,residual_mlp_baseline,cifar10,0.5775,1.9,0
2026-10-29 19:35,git+https://github.com/cchamb-gh/AI4200-imagenet32x32-baseline-model.git,residual_mlp_baseline,imagenet32,0.1054,15.6,0
2026-10-29 19:49,git+https://github.com/cchamb-gh/AI4200-imagenet32x32-baseline-model.git,residual_mlp_baseline,mnist,0.9894,1.2,0
2026-10-29 19:51,git+https://github.com/cchamb-gh/AI4200-imagenet32x32-baseline-model.git,residual_mlp_baseline,cifar10,0.5733,2.0,0
2026-10-29 20:07,git+https://github.com/cchamb-gh/AI4200-imagenet32x32-baseline-model.git,residual_mlp_baseline,imagenet32,0.1065,16.2,0
2026-10-29 21:44,git+https://github.com/cchamb-gh/AI4200-imagenet32x32-baseline-model.git,residual_mlp_baseline,mnist,0.9894,1.2,0
2026-10-29 21:49,git+https://github.com/cchamb-gh/AI4200-imagenet32x32-baseline-model.git,residual_mlp_baseline,cifar10,0.5883,5.0,0
2026-10-29 22:30,git+https://github.com/cchamb-gh/AI4200-imagenet32x32-baseline-model.git,residual_mlp_baseline,imagenet32,0.1024,40.9,0
2026-10-29 23:12,git+https://github.com/cchamb-gh/AI4200-imagenet32x32-baseline-model.git,residual_mlp_baseline,mnist,0.9894,1.2,0
2026-10-29 23:17,git+https://github.com/cchamb-gh/AI4200-imagenet32x32-baseline-model.git,residual_mlp_baseline,cifar10,0.5883,5.1,0
2026-10-30 00:00,git+https://github.com/cchamb-gh/AI4200-imagenet32x32-baseline-model.git,residual_mlp_baseline,imagenet32,0.1024,42.2,0
2026-10-30 16:03,git+https://github.com/cchamb-gh/AI4200-imagenet32x32-baseline-model.git,residual_mlp_baseline,mnist,0.9894,1.2,0
2026-10-30 16:05,git+https://github.com/cchamb-gh/AI4200-imagenet32x32-baseline-model.git,residual_mlp_baseline,cifar10,0.5775,2.4,0
2026-10-31 17:00,git+https://github.com/cchamb-gh/AI4200-imagenet32x32-baseline-model.git,residual_mlp_baseline,mnist,0.9894,1.2,0
2026-10-31 17:02,git+https://github.com/cchamb-gh/AI4200-imagenet32x32-baseline-model.git,residual_mlp_baseline,cifar10,0.5775,2.0,0

LOG.md

### Change 1 - mnist - 2026-10-08

**Result:** mnist accuracy went from 95.06% to 97.23%. Training duration grew from 0.6 to 1.1
minutes.

### Change 2 - mnist and cifar - 2026-10-15

**Result:** There was a decrease in training time for cifar and imagenet from the baseline. cifar
trained 30 epochs in 1.5 minutes, and imagenet trained 10 epochs in 13.7 minutes. Both of those have
the original epoch count. I'm a little skeptical of accurate timing, though. The HPC node I was
executing on had four other users with heavy loads executing at the same time. there may have been
some resource competition. As for accuracy, I saw a very small improvement in accuracy for cifar
(0.48 to 0.49) and imagenet (0.07 to 0.08).

### Change 4 - mnist - 2026-10-19 #363ab7dd

**Result:** Training time decreased in half. It was already very quick since this uses simple
layers, but it went from 0.6 to 0.3 minutes of training time. The bug fix removed 13 layers, so we
just had a total of 13 hidden layers remaining. Accuracy dropped less than a percent to 97.04% for
MNIST. That tells me that the extra layers really weren't contributing much. 2026-10-19
15:20,git+https://github.com/cchamb-gh/AI4200-imagenet32x32-baseline-model.git,residual_mlp_baseline,mnist,0.9704,0.3,0

### Change 10 - SwiGLU, bug fix - 2026-10-26 - #09b5376eb

**Result:** Models did learn. The bugfix worked. Accuracy measurement was slightly lower than the
original ResidualMLP network from previous commits BUT training was much faster because the new
SwiGLU network was using the original batch size of 256. Training was 14.8 minutes compared to 42+
minutes for the 64 batch size.

* mnist:      97.75%,  0.7 minutes
    * cifar10:    51.29%,  1.6 minutes
    * imagenet32:  5.86%, 14.8 minutes

### Change 12 - input standardization - 2026-10-26 - #6bba0b84

**Result:** mnist increased by less than one percent going from 97.28% to 97.52%. cifar10 went from
44.73% to 45.05%. So, that's some improvment but really not very much. After making this change, I
saw documentation about standardizing invidiaul channels in the RGB images instead of just having a
single pixel mean and std. That makes sense. I'll put that into a future change.